scientific_name	sample_group	tissue	genotype	sex	age	treatment	source_name	is_sampled	is_qualified	exclusion	protocol	bioproject	biosample	experiment	run	sra_primary	sra_sample	sra_study	study_title	exp_title	design	sample_title	sample_description	lib_name	lib_layout	lib_strategy	lib_source	lib_selection	instrument	total_spots	total_bases	size	nominal_length	nominal_sdev	spot_length	read_index	read_class	read_type	base_coord	lab	center	submitter_id	pubmed_id	taxid	published_date	biomaterial_provider	cell	location	antibody	batch	misc	NCBI_Link	AWS_Link	GCP_Link
Apis mellifera	pupa	Pupa						yes	yes	no		PRJNA533756	SAMN11466347	SRX6463300	SRR9705310	SRA922735	SRS5113122	SRP193058	Convergent eusocial evolution is based on a shared reproductive groundplan plus lineage-specific plastic genes	RNA-seq of ant and honey bee caste:Bee_GP-1	polyA synthesis; 16 PCR cycles for cDNA synthesis; 50 cycles			Bee_GP-1	single	RNA-Seq	TRANSCRIPTOMIC	RT-PCR	Illumina HiSeq 2500	17246845	873202225.0	370110783.0								Biology	University of Pennsylvania	SUB6028726		7460	2019-07-18 13:30:39							https://sra-downloadb.be-md.ncbi.nlm.nih.gov/sos5/sra-pub-zq-16/SRR009/705/SRR9705310.sralite.1	https://sra-pub-run-odp.s3.amazonaws.com/sra/SRR9705310/SRR9705310	gs://sra-pub-zq-107/SRR9705310/SRR9705310.zq.1
Apis mellifera	pupa	pupa					Worker pupa	yes	yes	no		PRJNA479740	SAMN09603764	SRX4341997	SRR7472360	SRA733556	SRS3502595	SRP152109	DNA methylation is maintained with high fidelity in the honey bee germline and exhibits global non-functional fluctuations during somatic development	GSM3244438: RNA-Seq worker pupa (experiment 2); Apis mellifera; RNA-Seq		RNA-Seq worker pupa (experiment 2)			single	RNA-Seq	TRANSCRIPTOMIC	cDNA	Illumina HiSeq 2000	92133396	9213339600.0	6185907715.0									GEO	GEO: GSE116629	31601251.0	7460	2019-10-02 17:28:11							https://sra-downloadb.be-md.ncbi.nlm.nih.gov/sos5/sra-pub-zq-16/SRR007/472/SRR7472360.sralite.1	https://sra-pub-run-odp.s3.amazonaws.com/sra/SRR7472360/SRR7472360	gs://sra-pub-zq-108/SRR7472360/SRR7472360.zq.1
Apis mellifera	pupa	pupa					Worker pupa	yes	yes	no		PRJNA479740	SAMN09603743	SRX4341990	SRR7472353	SRA733556	SRS3502588	SRP152109	DNA methylation is maintained with high fidelity in the honey bee germline and exhibits global non-functional fluctuations during somatic development	GSM3244431: RNA-Seq worker pupa (experiment 1); Apis mellifera; RNA-Seq		RNA-Seq worker pupa (experiment 1)			single	RNA-Seq	TRANSCRIPTOMIC	cDNA	Illumina HiSeq 2000	78911350	7891135000.0	5218269942.0									GEO	GEO: GSE116629	31601251.0	7460	2019-10-02 17:28:11							https://sra-downloadb.be-md.ncbi.nlm.nih.gov/sos9/sra-pub-zq-922/SRR007/472/SRR7472353.sralite.1	https://sra-pub-run-odp.s3.amazonaws.com/sra/SRR7472353/SRR7472353	gs://sra-pub-zq-108/SRR7472353/SRR7472353.zq.1
Apis mellifera	whole bodies	whole bodies						yes	yes	no		PRJNA531527	SAMN11368528	SRX5654486	SRR8867392	SRA871246	SRS4599489	SRP191454	RNA virus diversity in apiary-associated insects	RNA-Seq of total pooled A. mellifera workers	Extraction of total RNA (RNeasy minikit, QIAGEN) followed by DNAse treatment, oligo d(T) priming and cDNA library prep			LIB6169_LDI5054	paired	RNA-Seq	TRANSCRIPTOMIC	cDNA	Illumina HiSeq 2500	13836027	2794877454.0	1954840462.0								Hawkesbury Institute for the Environment	Western Sydney University	SUB5403726		7460	2019-07-31 01:09:23							https://sra-downloadb.be-md.ncbi.nlm.nih.gov/sos5/sra-pub-zq-16/SRR008/867/SRR8867392.sralite.1	https://sra-pub-run-odp.s3.amazonaws.com/sra/SRR8867392/SRR8867392	gs://sra-pub-zq-103/SRR8867392/SRR8867392.zq.1
Apis mellifera	whole bodies	whole bodies						yes	yes	no		PRJNA531527	SAMN11368527	SRX5654485	SRR8867393	SRA871246	SRS4599488	SRP191454	RNA virus diversity in apiary-associated insects	RNA-Seq of total pooled A. mellifera workers	Extraction of total RNA (RNeasy minikit, QIAGEN) followed by DNAse treatment, oligo d(T) priming and cDNA library prep			LIB6115_LDI5020	paired	RNA-Seq	TRANSCRIPTOMIC	cDNA	Illumina HiSeq 2500	17781138	3591789876.0	2455395404.0								Hawkesbury Institute for the Environment	Western Sydney University	SUB5403726		7460	2019-07-31 01:09:23							https://sra-downloadb.be-md.ncbi.nlm.nih.gov/sos9/sra-pub-zq-922/SRR008/867/SRR8867393.sralite.1	https://sra-pub-run-odp.s3.amazonaws.com/sra/SRR8867393/SRR8867393	gs://sra-pub-zq-103/SRR8867393/SRR8867393.zq.1
