scientific_name	sample_group	tissue	genotype	sex	age	treatment	source_name	is_sampled	is_qualified	exclusion	protocol	bioproject	biosample	experiment	run	sra_primary	sra_sample	sra_study	study_title	exp_title	design	sample_title	sample_description	lib_name	lib_layout	lib_strategy	lib_source	lib_selection	instrument	total_spots	total_bases	size	nominal_length	nominal_sdev	spot_length	read_index	read_class	read_type	base_coord	lab	center	submitter_id	pubmed_id	taxid	published_date	biomaterial_provider	cell	location	antibody	batch	misc	NCBI_Link	AWS_Link	GCP_Link
Apis mellifera	whole body	whole body		female	6 day			yes	yes	no		PRJNA1416624	SAMN54972994	SRX31991940	SRR37045115	SRA2325264	SRS27933809	SRP671484	bee prepupa with DWV injection	RNA-seq of female Apis mellifera prepupa	Total RNA was extracted using Trizol reagent kit according to the manufacturers protocol. RNA quality was assessed on an Agilent 2100 Bioanalyzer and checked using RNase free agarose gel electrophoresis. After total RNA was extracted, eukaryotic mRNA was enriched by Oligo(dT) Beads. Then the enriched mRNA was fragmented into short fragments using fragmentation buffer and reversly transcribed into cDNA by using NEBNext Ultra RNA Library Prep Kit for Illumina.The purified double-stranded cDNA fragments were end repaired, A base added, and ligated to Illumina sequencing adapters.The ligation reaction was purified with the AMPure XP Beads(1.0X).And polymerase chain reaction (PCR) amplified.The resulting cDNA library was sequenced using Illumina Novaseq6000 by Gene Denovo Biotechnology Co..			E11	paired	RNA-Seq	TRANSCRIPTOMIC	PCR	Illumina NovaSeq 6000	22075345	6622603500.0	1903806753.0								Animal science	Yangzhou University	SUB15975005		7460	2026-01-30 04:57:20							https://sra-downloadb.be-md.ncbi.nlm.nih.gov/sos10/sra-pub-zq-1002/SRR037/37045/SRR37045115/SRR37045115.lite.1	https://sra-pub-run-odp.s3.amazonaws.com/sra/SRR37045115/SRR37045115	gs://sra-pub-zq-105/SRR37045115/SRR37045115.lite.1
Apis mellifera	whole body	whole body		female	6 day			yes	yes	no		PRJNA1416624	SAMN54972985	SRX31991939	SRR37045116	SRA2325264	SRS27933808	SRP671484	bee prepupa with DWV injection	RNA-seq of female Apis mellifera prepupa	Total RNA was extracted using Trizol reagent kit according to the manufacturers protocol. RNA quality was assessed on an Agilent 2100 Bioanalyzer and checked using RNase free agarose gel electrophoresis. After total RNA was extracted, eukaryotic mRNA was enriched by Oligo(dT) Beads. Then the enriched mRNA was fragmented into short fragments using fragmentation buffer and reversly transcribed into cDNA by using NEBNext Ultra RNA Library Prep Kit for Illumina.The purified double-stranded cDNA fragments were end repaired, A base added, and ligated to Illumina sequencing adapters.The ligation reaction was purified with the AMPure XP Beads(1.0X).And polymerase chain reaction (PCR) amplified.The resulting cDNA library was sequenced using Illumina Novaseq6000 by Gene Denovo Biotechnology Co..			E2	paired	RNA-Seq	TRANSCRIPTOMIC	PCR	Illumina NovaSeq 6000	21149836	6344950800.0	1821827236.0								Animal science	Yangzhou University	SUB15975005		7460	2026-01-30 04:57:20							https://sra-downloadb.be-md.ncbi.nlm.nih.gov/sos10/sra-pub-zq-1002/SRR037/37045/SRR37045116/SRR37045116.lite.1	https://sra-pub-run-odp.s3.amazonaws.com/sra/SRR37045116/SRR37045116	gs://sra-pub-zq-105/SRR37045116/SRR37045116.lite.1
Apis mellifera	whole body	whole body		female	6 day			yes	yes	no		PRJNA1416624	SAMN54972984	SRX31991938	SRR37045117	SRA2325264	SRS27933807	SRP671484	bee prepupa with DWV injection	RNA-seq of female Apis mellifera prepupa	Total RNA was extracted using Trizol reagent kit according to the manufacturers protocol. RNA quality was assessed on an Agilent 2100 Bioanalyzer and checked using RNase free agarose gel electrophoresis. After total RNA was extracted, eukaryotic mRNA was enriched by Oligo(dT) Beads. Then the enriched mRNA was fragmented into short fragments using fragmentation buffer and reversly transcribed into cDNA by using NEBNext Ultra RNA Library Prep Kit for Illumina.The purified double-stranded cDNA fragments were end repaired, A base added, and ligated to Illumina sequencing adapters.The ligation reaction was purified with the AMPure XP Beads(1.0X).And polymerase chain reaction (PCR) amplified.The resulting cDNA library was sequenced using Illumina Novaseq6000 by Gene Denovo Biotechnology Co..			E1	paired	RNA-Seq	TRANSCRIPTOMIC	PCR	Illumina NovaSeq 6000	18602431	5580729300.0	1612377603.0								Animal science	Yangzhou University	SUB15975005		7460	2026-01-30 04:57:20							https://sra-downloadb.be-md.ncbi.nlm.nih.gov/sos10/sra-pub-zq-1002/SRR037/37045/SRR37045117/SRR37045117.lite.1	https://sra-pub-run-odp.s3.amazonaws.com/sra/SRR37045117/SRR37045117	gs://sra-pub-zq-105/SRR37045117/SRR37045117.lite.1
Apis mellifera	whole body	Whole body		not applicable	not applicable			yes	yes	no		PRJNA1356701	SAMN53066531	SRX30983744	SRR35934454	SRA2266938	SRS26976841	SRP640145	RNA-seq of Apis mellifera	RNA-seq of Apis mellifera	RNA libraries were constructed with TruSeq standard total RNA library prep gold kit.	RNA-seq of Apis mellifera : control		CON	paired	RNA-Seq	TRANSCRIPTOMIC	cDNA	Illumina NovaSeq 6000	196988388	39791654376.0	12462757902.0								Department of Plant Medicals	Insect Pathology and Toxicology Lab, Gyeongkuk National University	SUB15747098		7460	2025-11-19 12:22:20							https://sra-downloadb.be-md.ncbi.nlm.nih.gov/sos4/sra-pub-zq-7/SRR035/35934/SRR35934454/SRR35934454.lite.1	https://sra-pub-run-odp.s3.amazonaws.com/sra/SRR35934454/SRR35934454	gs://sra-pub-zq-103/SRR35934454/SRR35934454.lite.1
Apis mellifera	whole body	Whole body						yes	yes	no		PRJNA1308597	SAMN50702935	SRX30165475	SRR35051254	SRA2199532	SRS26225984	SRP610180	Comparing virome composition between honey bees (Apis mellifera) and small carpenter bees (Ceratina calcarata) in response to various agricultural landscapes	RNA-Seq_Apis mellifera	RNA-seq libraries from adult Apis mellifera whole body			X10176_Li-ByarlayH_R2-1_V1N_1_S28_R1_001	paired	RNA-Seq	TRANSCRIPTOMIC	cDNA	Illumina NovaSeq X	21949004	4433698808.0	1454563514.0								Agricultural Research and Development Program	Central State University,	SUB15549202		7460	2025-08-20 15:26:39							https://sra-downloadb.be-md.ncbi.nlm.nih.gov/sos1/sra-pub-zq-38/SRR035/35051/SRR35051254/SRR35051254.lite.1	https://sra-pub-run-odp.s3.amazonaws.com/sra/SRR35051254/SRR35051254	gs://sra-pub-zq-106/SRR35051254/SRR35051254.lite.1
