scientific_name	sample_group	tissue	genotype	sex	age	treatment	source_name	is_sampled	is_qualified	exclusion	protocol	bioproject	biosample	experiment	run	sra_primary	sra_sample	sra_study	study_title	exp_title	design	sample_title	sample_description	lib_name	lib_layout	lib_strategy	lib_source	lib_selection	instrument	total_spots	total_bases	size	nominal_length	nominal_sdev	spot_length	read_index	read_class	read_type	base_coord	lab	center	submitter_id	pubmed_id	taxid	published_date	biomaterial_provider	cell	location	antibody	batch	misc	NCBI_Link	AWS_Link	GCP_Link
Apis mellifera	4 pairs of antennae	4 pairs of antennae					Antennae	yes	yes	no		PRJNA268450	SAMN03220259	SRX767484	SRR1662285	SRA204462	SRS752093	SRP050250	Antennae transcriptomics of Varroa-hygienic and Nurse/Forager bees	GSM1553554: VSH1; Apis mellifera; RNA-Seq		VSH1			single	RNA-Seq	TRANSCRIPTOMIC	cDNA	Illumina HiSeq 2500	19536465	976823250.0	677226248.0									GEO	GEO: GSE63613	26000641.0	7460	2017-02-09 16:43:47							https://sra-downloadb.be-md.ncbi.nlm.nih.gov/sos5/sra-pub-zq-11/SRR001/662/SRR1662285/SRR1662285.sralite.1	https://sra-pub-run-odp.s3.amazonaws.com/sra/SRR1662285/SRR1662285	gs://sra-pub-zq-107/SRR1662285/SRR1662285.zq.1
Apis mellifera	hypopharyngeal glands tissue	Hypopharyngeal glands tissue			day 9 after emergence from the comb		Hypopharyngeal glands tissue	yes	yes	no		PRJNA244920	SAMN02729879	SRX521790	SRR1254943	SRA158671	SRS594443	SRP041288	Investigating the Regulation of Hypopharyngeal Gland Activity in Honeybees Undergoing Harsh Winter Conditions through RNA-seq Transcriptomics Combined with iTRAQ-based Comparative Proteomics	GSM1371075: Sample C (retired bee); Apis mellifera; RNA-Seq		Sample C (retired bee)			single	RNA-Seq	TRANSCRIPTOMIC	cDNA	Illumina HiSeq 2000	7586964	371761236.0	336190248.0									GEO	GEO: GSE56910		7460	2018-01-02 09:05:18							https://sra-downloadb.be-md.ncbi.nlm.nih.gov/sos5/sra-pub-run-32/SRR001/1254/SRR1254943/SRR1254943.2	https://sra-pub-run-odp.s3.amazonaws.com/sra/SRR1254943/SRR1254943	gs://sra-pub-run-105/SRR1254943/SRR1254943.2
Apis mellifera	hypopharyngeal glands tissue	Hypopharyngeal glands tissue			day 6 after emergence from the comb		Hypopharyngeal glands tissue	yes	yes	no		PRJNA244920	SAMN02729878	SRX521789	SRR1254942	SRA158671	SRS594444	SRP041288	Investigating the Regulation of Hypopharyngeal Gland Activity in Honeybees Undergoing Harsh Winter Conditions through RNA-seq Transcriptomics Combined with iTRAQ-based Comparative Proteomics	GSM1371074: Sample B (spring bee); Apis mellifera; RNA-Seq		Sample B (spring bee)			single	RNA-Seq	TRANSCRIPTOMIC	cDNA	Illumina HiSeq 2000	8957903	438937247.0	397331993.0									GEO	GEO: GSE56910		7460	2018-01-02 09:05:18							https://sra-downloadb.be-md.ncbi.nlm.nih.gov/sos5/sra-pub-run-32/SRR001/1254/SRR1254942/SRR1254942.2	https://sra-pub-run-odp.s3.amazonaws.com/sra/SRR1254942/SRR1254942	gs://sra-pub-run-105/SRR1254942/SRR1254942.2
Apis mellifera	hypopharyngeal glands tissue	Hypopharyngeal glands tissue			day 3 after emergence from the comb		Hypopharyngeal glands tissue	yes	yes	no		PRJNA244920	SAMN02729877	SRX521788	SRR1254941	SRA158671	SRS594442	SRP041288	Investigating the Regulation of Hypopharyngeal Gland Activity in Honeybees Undergoing Harsh Winter Conditions through RNA-seq Transcriptomics Combined with iTRAQ-based Comparative Proteomics	GSM1371073: Sample A (winter bee); Apis mellifera; RNA-Seq		Sample A (winter bee)			single	RNA-Seq	TRANSCRIPTOMIC	cDNA	Illumina HiSeq 2000	8626009	422674441.0	382581933.0									GEO	GEO: GSE56910		7460	2018-01-02 09:05:18							https://sra-downloadb.be-md.ncbi.nlm.nih.gov/sos5/sra-pub-run-32/SRR001/1254/SRR1254941/SRR1254941.2	https://sra-pub-run-odp.s3.amazonaws.com/sra/SRR1254941/SRR1254941	gs://sra-pub-run-105/SRR1254941/SRR1254941.2
Apis mellifera	second thoracic ganglia	Second Thoracic Ganglia		female	1-7 weeks			yes	yes	no		PRJNA243651	SAMN02728803	SRX519438	SRR1255546	SRA156363	SRS593582	SRP041189	Apis mellifera Tissue Study	Second Thoracic Ganglia polyA RNA of Apis mellifera Nurse (Colony 3)	Libraries were made with the NEBNext Illumina RNA-Seq library kit according to the manufacturer’s instructions. Sequencing was performed on the HiSeq 2000 (100 bp paired end).	Second Thoracic Ganglia polyA RNA of Apis mellifera (Nurse)	Second Thoracic Ganglia of the Nurse caste of Apis mellifera. Tissues were stored at -80C. RNA was extracted using Trizol protocl. Tissues homogenized in Trizol within 5 minutes of dissection.	Second_Thoracic_Ganglia_Apis_mellifera_Nurse_C3	paired	RNA-Seq	TRANSCRIPTOMIC	PolyA	Illumina HiSeq 2000	31677666	6335533200.0	4123937608.0	100.0	0.0	200.0	0.0	Application Read	Forward	1.0	Johnson	UC Davis Department of Entomology and Nematology	Amel Tissue Study		7460	2014-11-05 17:31:52	Harry H. Laidlaw Jr. Honey Bee Research Facility 1 Bee Biology Rd, Davis, CA 95616						https://sra-downloadb.be-md.ncbi.nlm.nih.gov/sos5/sra-pub-zq-11/SRR001/255/SRR1255546/SRR1255546.sralite.1	https://sra-pub-run-odp.s3.amazonaws.com/sra/SRR1255546/SRR1255546	gs://sra-pub-zq-103/SRR1255546/SRR1255546.zq.1
