scientific_name	sample_group	tissue	genotype	sex	age	treatment	source_name	is_sampled	is_qualified	exclusion	protocol	bioproject	biosample	experiment	run	sra_primary	sra_sample	sra_study	study_title	exp_title	design	sample_title	sample_description	lib_name	lib_layout	lib_strategy	lib_source	lib_selection	instrument	total_spots	total_bases	size	nominal_length	nominal_sdev	spot_length	read_index	read_class	read_type	base_coord	lab	center	submitter_id	pubmed_id	taxid	published_date	biomaterial_provider	cell	location	antibody	batch	misc	NCBI_Link	AWS_Link	GCP_Link
Apis mellifera	brain tissue	brain tissue		not collected	9 ages			yes	yes	no		PRJNA1100956	SAMN40982348	SRX24295553	SRR28729451	SRA1848100	SRS21059805	SRP502519	Apis mellifera Genome sequencing and assembly	RNA-seq of Apis mellifera:9 ages worker bees	RNA-seq of Apis mellifera worker brain,replication 2 of strong behaviors			MS_2	paired	RNA-Seq	TRANSCRIPTOMIC	PolyA	Illumina HiSeq 4000	23389756	7016926800.0	2257988842.0								Bee Scinence and Biomedicine	Fujian Agriculture and Forestry University	SUB14382255		7460	2024-11-01 01:25:13							https://sra-downloadb.be-md.ncbi.nlm.nih.gov/sos4/sra-pub-zq-5/SRR028/28729/SRR28729451/SRR28729451.lite.1	https://sra-pub-run-odp.s3.amazonaws.com/sra/SRR28729451/SRR28729451	gs://sra-pub-zq-103/SRR28729451/SRR28729451.lite.1
Apis mellifera	brain tissue	brain tissue		not collected	9 ages			yes	yes	no		PRJNA1100956	SAMN40982347	SRX24295552	SRR28729452	SRA1848100	SRS21059804	SRP502519	Apis mellifera Genome sequencing and assembly	RNA-seq of Apis mellifera:9 ages worker bees	RNA-seq of Apis mellifera worker brain,replication 1 of strong behaviors			MS_1	paired	RNA-Seq	TRANSCRIPTOMIC	PolyA	Illumina HiSeq 4000	20404558	6121367400.0	1931498902.0								Bee Scinence and Biomedicine	Fujian Agriculture and Forestry University	SUB14382255		7460	2024-11-01 01:25:13							https://sra-downloadb.be-md.ncbi.nlm.nih.gov/sos4/sra-pub-zq-5/SRR028/28729/SRR28729452/SRR28729452.lite.1	https://sra-pub-run-odp.s3.amazonaws.com/sra/SRR28729452/SRR28729452	gs://sra-pub-zq-103/SRR28729452/SRR28729452.lite.1
Apis mellifera	mandibular gland	Mandibular Gland		female	21 days			yes	yes	no		PRJNA1093158	SAMN40648574	SRX24094216	SRR28492035	SRA1835442	SRS20883501	SRP498512	MicroRNA-dependent regulation of caste and reproductive status in the honey bee (Apis mellifera L.)	TAG-Seq of Mandibular Gland queenless worker fed antagomir for ame-miR-7-5p	RNA samples were submitted to the UC Davis Genome Center for library construction and sequencing.		queen-less worker fed anti-ame-miR-7-5p antagomir	S14	single	RNA-Seq	TRANSCRIPTOMIC	PCR	NextSeq 500	5406099	546015999.0	283359845.0								Entomology & Nematology	University of California, Davis	SUB14342324		7460	2025-04-25 01:07:31							https://sra-downloadb.be-md.ncbi.nlm.nih.gov/sos8/sra-pub-zq-820/SRR028/28492/SRR28492035/SRR28492035.lite.1	https://sra-pub-run-odp.s3.amazonaws.com/sra/SRR28492035/SRR28492035	gs://sra-pub-zq-105/SRR28492035/SRR28492035.lite.1
Apis mellifera	mandibular gland	Mandibular Gland		female	21 days			yes	yes	no		PRJNA1093158	SAMN40648560	SRX24094201	SRR28492050	SRA1835442	SRS20883486	SRP498512	MicroRNA-dependent regulation of caste and reproductive status in the honey bee (Apis mellifera L.)	TAG-Seq of Mandibular Gland queenless worker fed antagomir for ame-miR-375-3p	RNA samples were submitted to the UC Davis Genome Center for library construction and sequencing.		queen-less worker fed anti-ame-miR-375-3p antagomir	S3	single	RNA-Seq	TRANSCRIPTOMIC	PCR	NextSeq 500	5017958	506813758.0	262296248.0								Entomology & Nematology	University of California, Davis	SUB14342324		7460	2025-04-25 01:07:31							https://sra-downloadb.be-md.ncbi.nlm.nih.gov/sos8/sra-pub-zq-820/SRR028/28492/SRR28492050/SRR28492050.lite.1	https://sra-pub-run-odp.s3.amazonaws.com/sra/SRR28492050/SRR28492050	gs://sra-pub-zq-105/SRR28492050/SRR28492050.lite.1
Apis mellifera	mandibular gland	mandibular gland			14 days			yes	yes	no		PRJNA498667	SAMN04910074	SRX1743305	SRR3476890	SRA420958	SRS1422528	SRP166960	Apis mellifera Raw sequence reads	Worker WQL				WQL	single	RNA-Seq	TRANSCRIPTOMIC	PolyA	Illumina HiSeq 2000	5711376	279857424.0	189074688.0			200.0	0.0	Application Read	Forward	1.0	apiculture laboratory	zhejiang university	MD	28674395.0	7460	2016-05-07 07:55:16							https://sra-downloadb.be-md.ncbi.nlm.nih.gov/sos5/sra-pub-zq-11/SRR003/476/SRR3476890/SRR3476890.sralite.1	https://sra-pub-run-odp.s3.amazonaws.com/sra/SRR3476890/SRR3476890	gs://sra-pub-zq-108/SRR3476890/SRR3476890.zq.1
