scientific_name	sample_group	tissue	genotype	sex	age	treatment	source_name	is_sampled	is_qualified	exclusion	protocol	bioproject	biosample	experiment	run	sra_primary	sra_sample	sra_study	study_title	exp_title	design	sample_title	sample_description	lib_name	lib_layout	lib_strategy	lib_source	lib_selection	instrument	total_spots	total_bases	size	nominal_length	nominal_sdev	spot_length	read_index	read_class	read_type	base_coord	lab	center	submitter_id	pubmed_id	taxid	published_date	biomaterial_provider	cell	location	antibody	batch	misc	NCBI_Link	AWS_Link	GCP_Link
Apis mellifera carnica	pooled pylori from 7 honey bees	Pooled pylori from 7 honey bees		female	10 days post emergence			yes	yes	no		PRJNA343067	SAMN05751704	SRX2188207	SRR4292727	SRA478122	SRS1711002	SRP090365	RNA-seq in the honey bee pylorus in response to the gut symbiont Frischella perrara	RNA-Seq of Apis mellifera: 7 pooled pylori from non-colonized bees (replicate1)	poly-A selection	7 pooled pylori from honey bees (10 days post emergence) not colonized with bacteria (replicate 1)	7 pooled pylori from honey bees (10 days post emergence) not colonized with bacteria (replicate 1)	NC1	single	RNA-Seq	TRANSCRIPTOMIC	other	Illumina HiSeq 2500	31089426	3140032026.0	1454139613.0								Department of Fundamental Microbiology	University of Lausanne	SUB1937899		88217	2017-02-08 00:00:00							https://sra-downloadb.be-md.ncbi.nlm.nih.gov/sos5/sra-pub-zq-11/SRR004/292/SRR4292727/SRR4292727.sralite.1	https://sra-pub-run-odp.s3.amazonaws.com/sra/SRR4292727/SRR4292727	gs://sra-pub-zq-101/SRR4292727/SRR4292727.zq.1
Apis mellifera capensis	mandibular gland	Mandibular gland		female	10 days			yes	yes	no		PRJNA1030416	SAMN37908173	SRX22157666	SRR26453438	SRA1736775	SRS19216627	SRP467577	Mandibular Gland transcriptome of African honey bees	RNA-seq of Apis mellifera capensis clone: day 10 Mandibular gland	Total RNA was isolated using TRIZol and treated with DNase. RNA quality and quantity was measured using a Nanodrop 2000 and samples sent for sequencing at BGI in Hong Kong. All samples had QC Class A classification with RIN on >7.4. cDNA libraries were constructed using the Illumina TRISeq RNA Preparation kit generating 100 bp paired ended fragments.	A. m. capensis clone Day 10		CapDay10	paired	RNA-Seq	TRANSCRIPTOMIC	PCR	Illumina HiSeq 4000	52313644	10462728800.0	4078845618.0								Zoology and Entomology	University of Pretoria	SUB13918072		293692	2025-07-11 16:13:02							https://sra-downloadb.be-md.ncbi.nlm.nih.gov/sos8/sra-pub-zq-818/SRR026/26453/SRR26453438/SRR26453438.lite.1	https://sra-pub-run-odp.s3.amazonaws.com/sra/SRR26453438/SRR26453438	gs://sra-pub-zq-108/SRR26453438/SRR26453438.lite.1
Apis mellifera capensis	mandibular gland	Mandibular gland		female	24 hours			yes	yes	no		PRJNA1030416	SAMN37908172	SRX22157665	SRR26453439	SRA1736775	SRS19216626	SRP467577	Mandibular Gland transcriptome of African honey bees	RNA-seq of Apis mellifera capensis clone: day 0 Mandibular gland	Total RNA was isolated using TRIZol and treated with DNase. RNA quality and quantity was measured using a Nanodrop 2000 and samples sent for sequencing at BGI in Hong Kong. All samples had QC Class A classification with RIN on >7.4. cDNA libraries were constructed using the Illumina TRISeq RNA Preparation kit generating 100 bp paired ended fragments.	A. m. capensis clone Day 0		CapDay0	paired	RNA-Seq	TRANSCRIPTOMIC	PCR	Illumina HiSeq 4000	52051738	10410347600.0	4083777555.0								Zoology and Entomology	University of Pretoria	SUB13918072		293692	2025-07-11 16:13:02							https://sra-downloadb.be-md.ncbi.nlm.nih.gov/sos8/sra-pub-zq-818/SRR026/26453/SRR26453439/SRR26453439.lite.1	https://sra-pub-run-odp.s3.amazonaws.com/sra/SRR26453439/SRR26453439	gs://sra-pub-zq-108/SRR26453439/SRR26453439.lite.1
Apis mellifera capensis	fat body	fat body		female	7 days			yes	yes	no		PRJNA438231	SAMN08708767	SRX3789884	SRR6833957	SRA666528	SRS3042428	SRP135683	Apis mellifera Transcriptome or Gene expression	RNAseq of Apis mellifera capensis: fat body tissue	Library preparation using the illumina  TruSeq RNA Library Prep Kit (Illumina, San Diego CA) and sequencing on an illumina  HiSeq4000 were done at the Beijing Genomics Institute (BGI) in Hong Kong, China.		extracted RNA from 3 individuals pooled for sequencing	FCH7G72BBXX-HKAPImqrEBBARABPEI-204	paired	RNA-Seq	TRANSCRIPTOMIC	RANDOM	Illumina HiSeq 4000	27796269	5557310669.0	2138307662.0								Molecular Ecology	Martin-Luther-University Halle-Wittenberg	SUB3783214		293692	2018-09-01 00:07:21							https://sra-downloadb.be-md.ncbi.nlm.nih.gov/sos5/sra-pub-zq-14/SRR006/833/SRR6833957.sralite.1	https://sra-pub-run-odp.s3.amazonaws.com/sra/SRR6833957/SRR6833957	gs://sra-pub-zq-104/SRR6833957/SRR6833957.zq.1
Apis mellifera capensis	fat body	fat body		female	8 days			yes	yes	no		PRJNA438231	SAMN08708768	SRX3789883	SRR6833958	SRA666528	SRS3042427	SRP135683	Apis mellifera Transcriptome or Gene expression	RNAseq of Apis mellifera capensis: fat body tissue	Library preparation using the illumina  TruSeq RNA Library Prep Kit (Illumina, San Diego CA) and sequencing on an illumina  HiSeq4000 were done at the Beijing Genomics Institute (BGI) in Hong Kong, China.		extracted RNA from 3 individuals pooled for sequencing	FCH7G72BBXX-HKAPImqrEBBBRAAPEI-205	paired	RNA-Seq	TRANSCRIPTOMIC	RANDOM	Illumina HiSeq 4000	32936064	6582025863.0	2509358338.0								Molecular Ecology	Martin-Luther-University Halle-Wittenberg	SUB3783214		293692	2018-09-01 00:07:21							https://sra-downloadb.be-md.ncbi.nlm.nih.gov/sos5/sra-pub-zq-14/SRR006/833/SRR6833958.sralite.1	https://sra-pub-run-odp.s3.amazonaws.com/sra/SRR6833958/SRR6833958	gs://sra-pub-zq-103/SRR6833958/SRR6833958.zq.1
