scientific_name	sample_group	tissue	genotype	sex	age	treatment	source_name	is_sampled	is_qualified	exclusion	protocol	bioproject	biosample	experiment	run	sra_primary	sra_sample	sra_study	study_title	exp_title	design	sample_title	sample_description	lib_name	lib_layout	lib_strategy	lib_source	lib_selection	instrument	total_spots	total_bases	size	nominal_length	nominal_sdev	spot_length	read_index	read_class	read_type	base_coord	lab	center	submitter_id	pubmed_id	taxid	published_date	biomaterial_provider	cell	location	antibody	batch	misc	NCBI_Link	AWS_Link	GCP_Link
Apis mellifera	abdomen	abdomen		female		TRMT1		yes	yes	no		PRJNA336281	SAMN05508587	SRX2003125	SRR4002871	SRA447888	SRS1603198	SRP080981	RNAi DWV Apis mellifera	RNA seq of abdomen/thorax of  individual 12 of treatment 1					paired	RNA-Seq	TRANSCRIPTOMIC	RANDOM	Illumina HiSeq 2000	9947347	1790522460.0	1224446889.0		0.0	180.0	0.0	Application Read	Forward	1.0	Laboratory of Socioecology and Social Evolution	KU Leuven	dwv_amel		7460	2016-12-20 00:00:00							https://sra-downloadb.be-md.ncbi.nlm.nih.gov/sos5/sra-pub-zq-11/SRR004/002/SRR4002871/SRR4002871.sralite.1	https://sra-pub-run-odp.s3.amazonaws.com/sra/SRR4002871/SRR4002871	gs://sra-pub-zq-101/SRR4002871/SRR4002871.noqual.1
Apis mellifera	abdomen	abdomen		female		TRMT1		yes	yes	no		PRJNA336281	SAMN05508585	SRX2003123	SRR4002869	SRA447888	SRS1603196	SRP080981	RNAi DWV Apis mellifera	RNA seq of abdomen/thorax of  individual 11 of treatment 1					paired	RNA-Seq	TRANSCRIPTOMIC	RANDOM	Illumina HiSeq 2000	7988393	1437910740.0	991247038.0		0.0	180.0	0.0	Application Read	Forward	1.0	Laboratory of Socioecology and Social Evolution	KU Leuven	dwv_amel		7460	2016-12-20 00:00:00							https://sra-downloadb.be-md.ncbi.nlm.nih.gov/sos5/sra-pub-zq-11/SRR004/002/SRR4002869/SRR4002869.sralite.1	https://sra-pub-run-odp.s3.amazonaws.com/sra/SRR4002869/SRR4002869	gs://sra-pub-zq-101/SRR4002869/SRR4002869.noqual.1
Apis mellifera	abdomen	abdomen				not fed with pollen	abdomen bees not parasitized by varroa not fed with pollen	yes	yes	no		PRJNA134353	SAMN00120280	SRX031130	SRR072892	SRA026467	SRS121201	SRP004440	Nutrigenomics in honey bees: the impact of pollen nutrients on bee health	GSM618184: abdomen bees not parasitized by varroa not fed with pollen		abdomen bees not parasitized by varroa not fed with pollen		GSM618184: abdomen bees not parasitized by varroa not fed with pollen	single	RNA-Seq	TRANSCRIPTOMIC	cDNA	Illumina Genome Analyzer	14817859	533442924.0	377149284.0			36.0	0.0	Application Read	Forward	1.0		GEO	GEO: GSE25161	21985689.0	7460	2011-11-07 08:24:56							https://sra-downloadb.be-md.ncbi.nlm.nih.gov/sos5/sra-pub-zq-11/SRR000/072/SRR072892/SRR072892.sralite.1	https://sra-pub-run-odp.s3.amazonaws.com/sra/SRR072892/SRR072892	gs://sra-pub-zq-101/SRR072892/SRR072892.zq.1
Apis mellifera	abdomen	abdomen				fed with pollen	abdomen bees not parasitized by varroa fed with pollen	yes	yes	no		PRJNA134353	SAMN00120279	SRX031129	SRR072891	SRA026467	SRS121200	SRP004440	Nutrigenomics in honey bees: the impact of pollen nutrients on bee health	GSM618183: abdomen bees not parasitized by varroa  fed with pollen		abdomen bees not parasitized by varroa  fed with pollen		GSM618183: abdomen bees not parasitized by varroa  fed with pollen	single	RNA-Seq	TRANSCRIPTOMIC	cDNA	Illumina Genome Analyzer	13508333	486299988.0	351972621.0			36.0	0.0	Application Read	Forward	1.0		GEO	GEO: GSE25161	21985689.0	7460	2011-11-07 08:24:56							https://sra-downloadb.be-md.ncbi.nlm.nih.gov/sos5/sra-pub-zq-11/SRR000/072/SRR072891/SRR072891.sralite.1	https://sra-pub-run-odp.s3.amazonaws.com/sra/SRR072891/SRR072891	gs://sra-pub-zq-101/SRR072891/SRR072891.zq.1
Apis mellifera	abdomen	abdomen				not fed with pollen	abdomen bees parasitized by varroa not fed with pollen	yes	yes	no		PRJNA134353	SAMN00120278	SRX031128	SRR072890	SRA026467	SRS121199	SRP004440	Nutrigenomics in honey bees: the impact of pollen nutrients on bee health	GSM618182: abdomen bees parasitized by varroa not fed with pollen		abdomen bees parasitized by varroa not fed with pollen		GSM618182: abdomen bees parasitized by varroa not fed with pollen	single	RNA-Seq	TRANSCRIPTOMIC	cDNA	Illumina Genome Analyzer	14346766	516483576.0	371154208.0			36.0	0.0	Application Read	Forward	1.0		GEO	GEO: GSE25161	21985689.0	7460	2011-11-07 08:24:56							https://sra-downloadb.be-md.ncbi.nlm.nih.gov/sos5/sra-pub-zq-11/SRR000/072/SRR072890/SRR072890.sralite.1	https://sra-pub-run-odp.s3.amazonaws.com/sra/SRR072890/SRR072890	gs://sra-pub-zq-101/SRR072890/SRR072890.zq.1
